{
  "schema_version": "research.platform-publication.v1",
  "generated_at": "2099-01-02T09:30:00+08:00",
  "producer_repository": "runchengxie/quant-research",
  "producer_commit": "fixture-quant-research-commit",
  "run_id": "daily-watch20-fixture-20990102",
  "artifacts": [
    {
      "artifact_id": "daily_watch20.watchlist",
      "relative_path": "watchlist_20.csv",
      "schema_version": "daily_watch20.watchlist.v1",
      "sha256": "bcbc6a0a5cc76017a7101aad478a61b1d02fd122478ef820f7a3e0d5614f24a8",
      "media_type": "text/csv",
      "audience": "internal",
      "consumers": ["market-intel"]
    },
    {
      "artifact_id": "daily_watch20.selection_receipt",
      "relative_path": "selection_receipt.json",
      "schema_version": "daily_watch20.selection-receipt.v1",
      "sha256": "5f6175a3300fa14ca7b8a236f98885ba7f66d04e1ea9d5d186845bf86223b26c",
      "media_type": "application/json",
      "audience": "internal",
      "consumers": ["market-intel"]
    }
  ]
}
